{
  "identifier": "06fe1cab-0a1a-430a-91c5-badf539189a5",
  "environment": "Container",
  "files":   [
    { 
      "identifier": "22701b37-0a8f-405c-a89b-c31be7cd4b89",
      "path": "parameter_flexi.ini",
      "metadata" :
        { 
          "syntaxHighlighting": "ini"
        },
      "parts": [
        {
          "identifier": "ceb051d8-b50c-4814-983a-b9d703cae0c6",
          "access"    : "modifiable",
          "metadata"  :
              { 
                "description"      : "Main parameters for flexi"
              },
          "content"   : "IT09PT09PT09PT09PT09PT09PT09PT09PT09PT09PT09PT09PT09PT09PT09PT09PT09PT09PT09PT09PT09PT09PT09PT09PT09PT09PT09PT09PT09PT09PT09PT09PT09PT09PT09PT09PT09PT09PT09PT09PT09PT09PT09PQohIENvcHlyaWdodCAoYykgMjAxNiAgUHJvZi4gQ2xhdXMtRGlldGVyIE11bnoKISBUaGlzIGZpbGUgaXMgcGFydCBvZiBGTEVYSSwgYSBoaWdoLW9yZGVyIGFjY3VyYXRlIGZyYW1ld29yayBmb3IgbnVtZXJpY2FsbHkgc29sdmluZyBQREVzIHdpdGggZGlzY29udGludW91cyBHYWxlcmtpbiBtZXRob2RzLgohIEZvciBtb3JlIGluZm9ybWF0aW9uIHNlZSBodHRwczovL3d3dy5mbGV4aS1wcm9qZWN0Lm9yZyBhbmQgaHR0cHM6Ly9ucmcuaWFnLnVuaS1zdHV0dGdhcnQuZGUvCiEKISBGTEVYSSBpcyBmcmVlIHNvZnR3YXJlOiB5b3UgY2FuIHJlZGlzdHJpYnV0ZSBpdCBhbmQvb3IgbW9kaWZ5IGl0IHVuZGVyIHRoZSB0ZXJtcyBvZiB0aGUgR05VIEdlbmVyYWwgUHVibGljIExpY2Vuc2UKISBhcyBwdWJsaXNoZWQgYnkgdGhlIEZyZWUgU29mdHdhcmUgRm91bmRhdGlvbiwgZWl0aGVyIHZlcnNpb24gMyBvZiB0aGUgTGljZW5zZSwgb3IgKGF0IHlvdXIgb3B0aW9uKSBhbnkgbGF0ZXIgdmVyc2lvbi4KIQohIEZMRVhJIGlzIGRpc3RyaWJ1dGVkIGluIHRoZSBob3BlIHRoYXQgaXQgd2lsbCBiZSB1c2VmdWwsIGJ1dCBXSVRIT1VUIEFOWSBXQVJSQU5UWTsgd2l0aG91dCBldmVuIHRoZSBpbXBsaWVkIHdhcnJhbnR5CiEgb2YgTUVSQ0hBTlRBQklMSVRZIG9yIEZJVE5FU1MgRk9SIEEgUEFSVElDVUxBUiBQVVJQT1NFLiBTZWUgdGhlIEdOVSBHZW5lcmFsIFB1YmxpYyBMaWNlbnNlIHYzLjAgZm9yIG1vcmUgZGV0YWlscy4KIQohIFlvdSBzaG91bGQgaGF2ZSByZWNlaXZlZCBhIGNvcHkgb2YgdGhlIEdOVSBHZW5lcmFsIFB1YmxpYyBMaWNlbnNlIGFsb25nIHdpdGggRkxFWEkuIElmIG5vdCwgc2VlIDxodHRwOi8vd3d3LmdudS5vcmcvbGljZW5zZXMvPi4KIT09PT09PT09PT09PT09PT09PT09PT09PT09PT09PT09PT09PT09PT09PT09PT09PT09PT09PT09PT09PT09PT09PT09PT09PT09PT09PT09PT09PT09PT09PT09PT09PT09PT09PT09PT09PT09PT09PT09PT09PT09PT09PT09PQohCiEgICBUaGlzIGEgcGFyYW1ldGVyIGZpbGUgZm9yIEZsZXhpIChodHRwczovL2ZsZXhpLXByb2plY3Qub3JnKQohCiEgICBVc2FnZTogbXBpcnVuIC1ucCBYWCAuL2ZsZXhpIHRoaXNwYXJhbWV0ZXJmaWxlLmluaSBvcgohICAgICAgICAgIC4vZmxleGkgdGhpc3BhcmFtZXRlcmZpbGUuaW5pCiEKISAgIFN0cnVjdHVyZTogS2V5d29yZCA9IFZhbHVlCiEgICAgICAgICAgICAgIE5vdCBjYXNlIHNlbnNpdGl2ZSwgb3JkZXIgb2Yga2V5d29yZHMgbm90IGltcG9ydGFudAohCiEgICAuL2ZsZXhpIC0taGVscCBmb3IgYSBsaXN0IG9mIGF2YWlsYWJsZSBzZXR0aW5ncwohCiE9PT09PT09PT09PT09PT09PT09PT09PT09PT09PT09PT09PT09PT09PT09PT09PT09PT09PT09PT09PT09PT09PT09PT09PT09PT09PT09PT09PT09PT09PT09PT09PT09PT09PT09PT09PT09PT09PT09PT09PT09PT09PT09PT0KISA9PT09PT09PT09PT09PT09PT09PT09PT09PT09PT09PT09PT09PT09PT09PT09PT09PT09PT09PT09PT09PT09PT09PT09PT09PT09PT09ICEKISBPVVRQVVQKISA9PT09PT09PT09PT09PT09PT09PT09PT09PT09PT09PT09PT09PT09PT09PT09PT09PT09PT09PT09PT09PT09PT09PT09PT09PT09PT09ICEKUHJvamVjdE5hbWUgICA9IFR1dG9yaWFsX0Nhdml0eV9SZTEwMF9tZXNoMngyCm91dHB1dEZvcm1hdCAgPSAwICAhID0wLCBubyB2aXN1LCA-MCB2aXN1YWxpemUKCiEgPT09PT09PT09PT09PT09PT09PT09PT09PT09PT09PT09PT09PT09PT09PT09PT09PT09PT09PT09PT09PT09PT09PT09PT09PT09PT09PSAhCiEgSU5URVJQT0xBVElPTgohID09PT09PT09PT09PT09PT09PT09PT09PT09PT09PT09PT09PT09PT09PT09PT09PT09PT09PT09PT09PT09PT09PT09PT09PT09PT09PT0gIQpOICAgICAgICAgICAgID0gMyAhIFBvbHlub21pYWwgZGVncmVlCk5BbmFseXplICAgICAgPSAxMCAhIE51bWJlciBvZiBhbmFseXplIHBvaW50cwoKISA9PT09PT09PT09PT09PT09PT09PT09PT09PT09PT09PT09PT09PT09PT09PT09PT09PT09PT09PT09PT09PT09PT09PT09PT09PT09PT09ICEKISBNRVNICiEgPT09PT09PT09PT09PT09PT09PT09PT09PT09PT09PT09PT09PT09PT09PT09PT09PT09PT09PT09PT09PT09PT09PT09PT09PT09PT09PSAhCk1lc2hGaWxlICAgICAgPSBjYXZpdHkyeDJfbWVzaC5oNQp1c2VDdXJ2ZWRzICAgID0gRgoKIUJvdW5kYXJ5TmFtZT1CQ193YWxsX2xvd2VyCiFCb3VuZGFyeVR5cGU9KC80LDEvKQpCb3VuZGFyeU5hbWU9QkNfd2FsbF9sZWZ0CkJvdW5kYXJ5VHlwZT0oLzQsMS8pCkJvdW5kYXJ5TmFtZT1CQ193YWxsX3JpZ2h0CkJvdW5kYXJ5VHlwZT0oLzQsMS8pCkJvdW5kYXJ5TmFtZT1CQ19mcmVlCkJvdW5kYXJ5VHlwZT0oLzIsMS8pCgohID09PT09PT09PT09PT09PT09PT09PT09PT09PT09PT09PT09PT09PT09PT09PT09PT09PT09PT09PT09PT09PT09PT09PT09PT09PT09PT0gIQohIEVRVUFUSU9OCiEgPT09PT09PT09PT09PT09PT09PT09PT09PT09PT09PT09PT09PT09PT09PT09PT09PT09PT09PT09PT09PT09PT09PT09PT09PT09PT09PSAhCkluaUV4YWN0RnVuYyAgPSAxCkluaVJlZlN0YXRlICAgPSAyClJlZlN0YXRlICAgICAgPSAoLzEuMCwxLiwwLiwwLiw3MS40Mjg1NzE0Mjg2LykKUmVmU3RhdGUgICAgICA9ICgvMS4wLDAuLDAuLDAuLDcxLjQyODU3MTQyODYvKQptdTAgICAgICAgICAgID0gMC4wMQpSICAgICAgICAgICAgID0gMQpQciAgICAgICAgICAgID0gMC43MgprYXBwYSAgICAgICAgID0gMS40CiEgPT09PT09PT09PT09PT09PT09PT09PT09PT09PT09PT09PT09PT09PT09PT09PT09PT09PT09PT09PT09PT09PT09PT09PT09PT09PT09PSAhCiEgRlYKISA9PT09PT09PT09PT09PT09PT09PT09PT09PT09PT09PT09PT09PT09PT09PT09PT09PT09PT09PT09PT09PT09PT09PT09PT09PT09PT09ICEKRlZfTGltaXRlclR5cGUgPSAxCkluZGljYXRvclR5cGUgID0gMApJbmRWYXIgICAgICAgICA9IDEKISA9PT09PT09PT09PT09PT09PT09PT09PT09PT09PT09PT09PT09PT09PT09PT09PT09PT09PT09PT09PT09PT09PT09PT09PT09PT09PT09ICEKISBUSU1FRElTQwohID09PT09PT09PT09PT09PT09PT09PT09PT09PT09PT09PT09PT09PT09PT09PT09PT09PT09PT09PT09PT09PT09PT09PT09PT09PT09PT0gIQp0ZW5kICAgICAgICAgID0gNS4wCkFuYWx5emVfZHQgICAgPSAwLjEKbldyaXRlRGF0YSAgICA9IDEKQ0ZMc2NhbGUgICAgICA9IDAuOTkKREZMc2NhbGUgICAgICA9IDAuNAoKISA9PT09PT09PT09PT09PT09PT09PT09PT09PT09PT09PT09PT09PT09PT09PT09PT09PT09PT09PT09PT09PT09PT09PT09PT09PT09PT09ICEKISBBTkFMWVpFCiEgPT09PT09PT09PT09PT09PT09PT09PT09PT09PT09PT09PT09PT09PT09PT09PT09PT09PT09PT09PT09PT09PT09PT09PT09PT09PT09PSAhCkNhbGNFcnJvck5vcm1zPSAgIFQgICAhIENhbGN1bGF0ZSBlcnJvciBub3JtcwpDYWxjQm9keUZvcmNlcz0gICBUICAgISBDYWxjdWxhdGUgYm9keSBmb3JjZXMKQ2FsY1dhbGxWZWxvY2l0eT0gVCAgICEgQ2FsY3VsYXRlIHdhbGwgdmVsb2NpdGllcwpDYWxjTWVhbkZsdXg9ICAgICBUICAgISBDYWxjdWxhdGUgbWVhbiBmbHV4IHRocm91Z2ggYm91bmRhcmllcwoKClZhck5hbWUgPSBQcmVzc3VyZQo"
        }
      ] 
    }
  ],
  "configuration" :
    { "resources.image"  : "file://flexi-docker.tar", 
      "resources.volume" : "/home/jovyan",
      "resources.memory" : "2g",
      "resources.numCPUs" : 2,
      "running.entrypoint" : "/workspace/entrypoint.sh",
      "running.commandLineArguments" : "/home/jovyan/parameter_flexi.ini"
    }
}
